{"partitions":{"already_fixed_independently":[],"confirmed_fixed_by_change":[],"invalid_or_unsupported":[],"reclassified_different_root_cause":[],"still_failing_same_root_cause":[{"assertion_locator":{"assertion_index":2,"exact_text":"Target player draws two cards.","span":{"end":143,"start":113}},"complete_gap_set":["keyword_unsupported","verb_unmapped:p_draw"],"oracle_face_id":"oracle:59b869b9-cb48-4152-ad91-52f582e2df5b:none","oracle_face_key":{"scryfallOracleId":"59b869b9-cb48-4152-ad91-52f582e2df5b","side":null},"quarantine_status":"clear","relation_readiness":"not_required","semantic_source_hash":"sha256:1415064e7993d1b8e1ac50fd27cde67696befb7336c6f1b3adecb2475cb7805e"},{"assertion_locator":{"assertion_index":1,"exact_text":"Target player draws two cards.","span":{"end":30,"start":0}},"complete_gap_set":["verb_unmapped:p_draw"],"oracle_face_id":"oracle:8f32ceb2-92c2-4dde-bf73-40bb79c3fcef:none","oracle_face_key":{"scryfallOracleId":"8f32ceb2-92c2-4dde-bf73-40bb79c3fcef","side":null},"quarantine_status":"clear","relation_readiness":"not_required","semantic_source_hash":"sha256:9f8861e78eb7aa8ca4fea409bf825d2bd36557244c91e0dbaf3d57283d0b3c98"}]},"schema":"magic.result-partition/v1","scope_hash":"sha256:7e03581e3de5bd7aca40ff4f2418cdea802b44694284dbfe22f3e66592800e50","status":"pending"}
